{
 "as_of": "2026-10-26T12:30:00Z",
 "facts": [
  {
   "id": "F1",
   "claim": "A three-judge Ninth Circuit panel held an emergency oral argument by videoconference on Sunday, Oct. 25, 2026, lasting nearly two hours, in case No. 26-7070, on DOJ's request for an injunction pending appeal to force California to set aside roughly 20,000 mail ballots tied to people DOJ says it believes are likely noncitizens, before a lower-court judge had ruled.",
   "is_new": true,
   "status": "confirmed",
   "sources": [
    {
     "url": "https://www.yahoo.com/news/politics/articles/justice-department-faces-skeptical-appeals-223440416.html",
     "kind": "press",
     "title": "Justice Department faces skeptical appeals court panel in California ballot fight",
     "outlet": "Politico (via Yahoo News)",
     "published_at": "2026-10-25T22:34:40Z"
    },
    {
     "url": "https://www.foxnews.com/politics/ninth-circuit-questions-trump-doj-emergency-request-set-aside-20000-california-mail-ballots",
     "kind": "press",
     "title": "Ninth Circuit questions Trump DOJ's emergency request to set aside 20,000 California mail ballots",
     "outlet": "Fox News",
     "published_at": "2026-10-25T21:26:06-04:00"
    }
   ]
  },
  {
   "id": "F2",
   "claim": "The three-judge panel was Circuit Judges Mark Bennett and Patrick Bumatay (both Trump appointees) and Gabriel Sanchez (a Biden appointee).",
   "is_new": true,
   "status": "confirmed",
   "sources": [
    {
     "url": "https://www.yahoo.com/news/politics/articles/justice-department-faces-skeptical-appeals-223440416.html",
     "kind": "press",
     "title": "Justice Department faces skeptical appeals court panel in California ballot fight",
     "outlet": "Politico (via Yahoo News)",
     "published_at": "2026-10-25T22:34:40Z"
    },
    {
     "url": "https://www.foxnews.com/politics/ninth-circuit-questions-trump-doj-emergency-request-set-aside-20000-california-mail-ballots",
     "kind": "press",
     "title": "Ninth Circuit questions Trump DOJ's emergency request to set aside 20,000 California mail ballots",
     "outlet": "Fox News",
     "published_at": "2026-10-25T21:26:06-04:00"
    }
   ]
  },
  {
   "id": "F3",
   "claim": "Judge Mark Bennett told DOJ's lawyer at the hearing: \"It seems to me you want us to issue an injunction that is entirely inconsistent with the law the California Legislature has adopted. How can we do that?\" and separately said, \"I just don't see [federal law] telling California how to do the sorting\" of citizens from noncitizens, framing the dispute as one over the Constitution's Elections Clause.",
   "is_new": true,
   "status": "confirmed",
   "sources": [
    {
     "url": "https://www.yahoo.com/news/politics/articles/justice-department-faces-skeptical-appeals-223440416.html",
     "kind": "press",
     "title": "Justice Department faces skeptical appeals court panel in California ballot fight",
     "outlet": "Politico (via Yahoo News)",
     "published_at": "2026-10-25T22:34:40Z"
    },
    {
     "url": "https://www.foxnews.com/politics/ninth-circuit-questions-trump-doj-emergency-request-set-aside-20000-california-mail-ballots",
     "kind": "press",
     "title": "Ninth Circuit questions Trump DOJ's emergency request to set aside 20,000 California mail ballots",
     "outlet": "Fox News",
     "published_at": "2026-10-25T21:26:06-04:00"
    }
   ]
  },
  {
   "id": "F4",
   "note": "Single-source quote/statement (only one outlet's text could be verified verbatim against raw HTML); not independently corroborated by a second outlet or a primary document.",
   "claim": "DOJ attorney Matthew Donnelly told the panel the government \"did not appreciate the scale\" of how quickly mail ballots were being processed and \"couldn't wait that long for relief,\" explaining why DOJ moved from an initial request for relief by Election Day to an emergency demand for action within days.",
   "is_new": true,
   "status": "unverified",
   "sources": [
    {
     "url": "https://www.yahoo.com/news/politics/articles/justice-department-faces-skeptical-appeals-223440416.html",
     "kind": "press",
     "title": "Justice Department faces skeptical appeals court panel in California ballot fight",
     "outlet": "Politico (via Yahoo News)",
     "published_at": "2026-10-25T22:34:40Z"
    }
   ]
  },
  {
   "id": "F5",
   "note": "Single-source quote/statement, not independently corroborated by a second outlet or a primary document.",
   "claim": "Samuel Siegel argued for California that DOJ lacks authority to override the state's system of citizenship self-attestation for voter registration; Seth Waxman, representing LA County Registrar Dean Logan, called DOJ's claim that it hadn't anticipated ballot-processing speed \"insulting\" and said \"the numbers are publicly available.\"",
   "is_new": true,
   "status": "unverified",
   "sources": [
    {
     "url": "https://www.yahoo.com/news/politics/articles/justice-department-faces-skeptical-appeals-223440416.html",
     "kind": "press",
     "title": "Justice Department faces skeptical appeals court panel in California ballot fight",
     "outlet": "Politico (via Yahoo News)",
     "published_at": "2026-10-25T22:34:40Z"
    }
   ]
  },
  {
   "id": "F6",
   "note": "Single-source quote/statement, not independently corroborated by a second outlet or a primary document.",
   "claim": "Judge Bennett cited Los Angeles County's IT declaration at the hearing, saying the county \"really can't do it at all without an extraordinary change in their processes, which could have this catastrophic impact,\" raising doubts about whether DOJ's requested remedy of segregating ~20,000 ballots was technically feasible on short notice.",
   "is_new": true,
   "status": "unverified",
   "sources": [
    {
     "url": "https://www.yahoo.com/news/politics/articles/justice-department-faces-skeptical-appeals-223440416.html",
     "kind": "press",
     "title": "Justice Department faces skeptical appeals court panel in California ballot fight",
     "outlet": "Politico (via Yahoo News)",
     "published_at": "2026-10-25T22:34:40Z"
    }
   ]
  },
  {
   "id": "F7",
   "note": "As of this dossier's as_of timestamp (2026-10-26, the day before the district hearing), neither the Ninth Circuit nor Judge Carter had ruled.",
   "claim": "The Ninth Circuit panel did not rule from the bench on Oct. 25; it took the case under submission. Fox News reported Bennett said the panel would try to issue a ruling as quickly as possible, and U.S. District Judge David O. Carter, based in Santa Ana, has a separate hearing on DOJ's request for a temporary restraining order set for Tuesday, Oct. 27, 2026.",
   "is_new": true,
   "status": "confirmed",
   "sources": [
    {
     "url": "https://www.yahoo.com/news/politics/articles/justice-department-faces-skeptical-appeals-223440416.html",
     "kind": "press",
     "title": "Justice Department faces skeptical appeals court panel in California ballot fight",
     "outlet": "Politico (via Yahoo News)",
     "published_at": "2026-10-25T22:34:40Z"
    },
    {
     "url": "https://www.foxnews.com/politics/ninth-circuit-questions-trump-doj-emergency-request-set-aside-20000-california-mail-ballots",
     "kind": "press",
     "title": "Ninth Circuit questions Trump DOJ's emergency request to set aside 20,000 California mail ballots",
     "outlet": "Fox News",
     "published_at": "2026-10-25T21:26:06-04:00"
    }
   ]
  },
  {
   "id": "F8",
   "claim": "The U.S. Department of Justice filed a civil complaint, United States v. State of California, Shirley N. Weber, and Dean C. Logan, No. 2:26-cv-12025 (C.D. Cal.), on Oct. 15, 2026, seeking declaratory and injunctive relief, alleging the state sent vote-by-mail ballots to \"over 20,000 names of people the Federal Government believes are likely noncitizens.\"",
   "is_new": false,
   "status": "confirmed",
   "sources": [
    {
     "url": "https://www.justice.gov/opa/media/1466286/dl",
     "kind": "primary",
     "title": "Complaint for Declaratory and Injunctive Relief, United States v. California et al., No. 2:26-cv-12025",
     "outlet": "U.S. Department of Justice",
     "published_at": "2026-10-15"
    }
   ],
   "primary_source": {
    "url": "https://www.justice.gov/opa/media/1466286/dl",
    "kind": "primary",
    "title": "Complaint for Declaratory and Injunctive Relief, United States v. California et al., No. 2:26-cv-12025",
    "outlet": "U.S. Department of Justice",
    "published_at": "2026-10-15"
   }
  },
  {
   "id": "F9",
   "claim": "DOJ's Oct. 13, 2026 letter demanded California/county officials review the ~20,000-name list and set aside implicated ballots by \"October 15 at noon EST\" — a deadline California Secretary of State Shirley Weber's Oct. 15 reply letter called \"a mere 48 hours.\"",
   "is_new": false,
   "status": "confirmed",
   "sources": [
    {
     "url": "https://admin.cdn.sos.ca.gov/pdf/other/casos-to-doj-101526.pdf",
     "kind": "primary",
     "title": "Letter from Secretary of State Shirley N. Weber to Acting Deputy Attorney General R. Trent McCotter",
     "outlet": "California Secretary of State",
     "published_at": "2026-10-15"
    }
   ],
   "primary_source": {
    "url": "https://admin.cdn.sos.ca.gov/pdf/other/casos-to-doj-101526.pdf",
    "kind": "primary",
    "title": "Letter from Secretary of State Shirley N. Weber to Acting Deputy Attorney General R. Trent McCotter",
    "outlet": "California Secretary of State",
    "published_at": "2026-10-15"
   }
  },
  {
   "id": "F10",
   "claim": "DOJ's original Oct. 13 letter to LA County Registrar Dean Logan included a USB drive with the suspected-noncitizen list and \"a handwritten note providing a password\"; LA County said it had not accessed the drive because doing so would conflict with its data-privacy and information-security protocols and because it did not consider the device a secure medium.",
   "is_new": false,
   "status": "confirmed",
   "sources": [